donor_id	donor_name	source_url	country_code	project_name	is_loan	amount_m	currency	amount_m_usd	objectives	main_components	start_date	start_ut	end_date	end_ut	duration	duration_unit	duration_unit_ticks	implementing_agency	executing_agency	Project Name	Loan / Grant	Amount (USD)	Objective/s	Main Component/s	Commencement Date	Duration	Implementing Agency	Executing Agency
17	East Asia - Japan	http://www.erd.gov.lk/index.php?option=com_rmobilization&view=resource_project&category_id=1&sub_category_id=1&searchby=donor_type&donor_id=17&today=2022-03-14&Itemid=321&lang=en	JP	Landslide Disaster Protection Project of the National Road Network (SL - P109)	True	7619.0	JPY	64.7615	Prevention & mitigation of the Landslide disasters for the improvement of road safety and reliability.	Implementation of Countermeasures for high priority areas of national roads for disaster management in 10 districts in Sri Lanka.; Establishment of Early warning system.	2013-03-14	1363219200						Road Development Authority	Ministry of Higher Education & Highways	Landslide Disaster Protection Project of the National Road Network (SL - P109)	Loan	JPY 7,619 Mn	Prevention & mitigation of the Landslide disasters for the improvement of road safety and reliability.	Implementation of Countermeasures for high priority areas of national roads for disaster management in 10 districts in Sri Lanka.; Establishment of Early warning system.	2013-03-14		Road Development Authority	Ministry of Higher Education & Highways
10	EXIM Bank of India	http://www.erd.gov.lk/index.php?option=com_rmobilization&view=resource_project&category_id=1&sub_category_id=1&searchby=donor_type&donor_id=10&today=2022-03-14&Itemid=321&lang=en	IN	Greater Dambulla Water Supply Project	True	60.69	USD	60.69	Dambulla; Galewela; Sigiriya; Habarana; Palugaswewa; Naula; Palagolla; Kekirawa.	70 km transmission line; 225 km distribution line; water intake and pumping station; water treatment plant; reservoirs	2012-01-17	1326758400						Ministry of City Planning and Water Supply	National Water Supply and Drainage Board	Greater Dambulla Water Supply Project	Loan	USD 60.69 Mn	Dambulla; Galewela; Sigiriya; Habarana; Palugaswewa; Naula; Palagolla; Kekirawa.	70 km transmission line; 225 km distribution line; water intake and pumping station; water treatment plant; reservoirs	2012-01-17		Ministry of City Planning and Water Supply	National Water Supply and Drainage Board
9	Saudi Fund for Development	http://www.erd.gov.lk/index.php?option=com_rmobilization&view=resource_project&category_id=1&sub_category_id=1&searchby=donor_type&donor_id=9&today=2022-03-14&Itemid=321&lang=en	SA	Rehabilitation of A05 Road Corridor from Badulla to Chenkaladi	True	60.0	USD	60.0	Rehabilitation and Improvement of Badulla Chenkaladi Road which is a key road corridor between Badulla in Uva Province and Chenkaladi located in the Eastern Province, Section from Bibile to Chenkaladi.	Road Improvement; Road Widening; Drainage Improvement Work; Road signs and Marking	2015-10-30	1446163200			5.0	year	157788000.0	Ministry of Higher Education and Highways	Road Development Authority	Rehabilitation of A05 Road Corridor from Badulla to Chenkaladi	Loan	USD 60 Mn	Rehabilitation and Improvement of Badulla Chenkaladi Road which is a key road corridor between Badulla in Uva Province and Chenkaladi located in the Eastern Province, Section from Bibile to Chenkaladi.	Road Improvement; Road Widening; Drainage Improvement Work; Road signs and Marking	2015-10-30	5 Years	Ministry of Higher Education and Highways	Road Development Authority
9	Saudi Fund for Development	http://www.erd.gov.lk/index.php?option=com_rmobilization&view=resource_project&category_id=1&sub_category_id=1&searchby=donor_type&donor_id=9&today=2022-03-14&Itemid=321&lang=en	SA	Road Network Development Project	True	60.0	USD	60.0	Katugastota - Naula Section of A9 Road; Dehiowita - Deraniyagala Road; Peliyagoda - Kiribathgoda Section of Kandy Road; Thambalagamuwa - Surangal Junction Section of Thampalakamam Kinniya Road	Road Improvement; Road Widening; Drainage Improvement Work; Road signs and Marking	2012-10-30	1351555200						Ministry of Higher Education and Highways	Road Development Authority	Road Network Development Project	Loan	USD 60 Mn	Katugastota - Naula Section of A9 Road; Dehiowita - Deraniyagala Road; Peliyagoda - Kiribathgoda Section of Kandy Road; Thambalagamuwa - Surangal Junction Section of Thampalakamam Kinniya Road	Road Improvement; Road Widening; Drainage Improvement Work; Road signs and Marking	2012-10-30		Ministry of Higher Education and Highways	Road Development Authority
37	EDCF EXIM Bank of Korea	http://www.erd.gov.lk/index.php?option=com_rmobilization&view=resource_project&category_id=1&sub_category_id=1&searchby=donor_type&donor_id=37&today=2022-03-14&Itemid=321&lang=en	KR	Deduru Oya Water Supply Project	True	58.155	USD	58.155	Provide safe drinking water to the residents in Mahawa and Polpithigama areas in Kurunegala District; Decreasing the incidence of water born deceases in the project area; Increasing the living conditions of the community; Promoting economic prosperity as preserving the environment through provision of safe drinking water	Providing adequate pipe born water supply to people in 97 Grama Niladari Divisions; Establishment of water treatment plant at Pothuwewa, construction of three eleveated water towers etc.	2014-10-30	1414627200						Water Supply and Drainage Board	Ministry of City Planning and Water Supply	Deduru Oya Water Supply Project	Loan	EDCF Portion - USD 58.155 Mn, GOSL Portion - USD Mn	Provide safe drinking water to the residents in Mahawa and Polpithigama areas in Kurunegala District; Decreasing the incidence of water born deceases in the project area; Increasing the living conditions of the community; Promoting economic prosperity as preserving the environment through provision of safe drinking water	Providing adequate pipe born water supply to people in 97 Grama Niladari Divisions; Establishment of water treatment plant at Pothuwewa, construction of three eleveated water towers etc.	2014-10-30		Water Supply and Drainage Board	Ministry of City Planning and Water Supply
37	EDCF EXIM Bank of Korea	http://www.erd.gov.lk/index.php?option=com_rmobilization&view=resource_project&category_id=1&sub_category_id=1&searchby=donor_type&donor_id=37&today=2022-03-14&Itemid=321&lang=en	KR	Improvement of Hatton Nuwara Eliya Road Project	True	57.0	USD	57.0	Rehabilitation the road section between Hatton and Nuwara Eliya to improve  the accessibility to the people living in the area, eliminate traffic congestion and enhance road safety.; Widening and improvement of 35.6 Km long Hatton-Nuwara Eliya road with 2 lane facility; construction of the underpass crossing at Nanuoya railway and Kotagala tunnel		2010-11-02	1288656000						Road Development Authority	Ministry of Highways and Road Development	Improvement of Hatton Nuwara Eliya Road Project	Loan	57 Million	Rehabilitation the road section between Hatton and Nuwara Eliya to improve  the accessibility to the people living in the area, eliminate traffic congestion and enhance road safety.; Widening and improvement of 35.6 Km long Hatton-Nuwara Eliya road with 2 lane facility; construction of the underpass crossing at Nanuoya railway and Kotagala tunnel		2010-11-02		Road Development Authority	Ministry of Highways and Road Development
28	French Agency for Development	http://www.erd.gov.lk/index.php?option=com_rmobilization&view=resource_project&category_id=1&sub_category_id=1&searchby=donor_type&donor_id=28&today=2022-03-14&Itemid=321&lang=en	FR	Anuradhapura Township Development Project	True	52.0	EUR	56.68000000000001			2016-12-01	1480550400						Ministry of Megapolis and Western Development	Ministry of Megapolis and Western Development	Anuradhapura Township Development Project	Loan	Euro 52,000,000			2016-12-01		Ministry of Megapolis and Western Development	Ministry of Megapolis and Western Development
12	China Development Bank (CDB)	http://www.erd.gov.lk/index.php?option=com_rmobilization&view=resource_project&category_id=1&sub_category_id=1&searchby=donor_type&donor_id=12&today=2022-03-14&Itemid=321&lang=en	CN	Katana Water Supply Project	True	54.8	USD	54.8		Construction of three towers at Bambukuliya, Ewariwatta and Thibirigaskatuwa; Laying of transmission and distribution mains and supplying and supplying and installation of pumps.	2017-08-21	1503273600						National Water Supply and Drainage Board	Ministry of City Planning & Water Supply	Katana Water Supply Project	Loan	54.8 mn		Construction of three towers at Bambukuliya, Ewariwatta and Thibirigaskatuwa; Laying of transmission and distribution mains and supplying and supplying and installation of pumps.	2017-08-21		National Water Supply and Drainage Board	Ministry of City Planning & Water Supply
35	Nordea Bank of Sweden	http://www.erd.gov.lk/index.php?option=com_rmobilization&view=resource_project&category_id=1&sub_category_id=1&searchby=donor_type&donor_id=35&today=2022-03-14&Itemid=321&lang=en	SE	Extension to the Rural Electrification Project 4	True	53.493454	USD	53.493454			2011-06-17	1308268800						Ceylon Electricity Board	Ministry of Power and Renewable Energy	Extension to the Rural Electrification Project 4	Loan	USD 53,493,454			2011-06-17		Ceylon Electricity Board	Ministry of Power and Renewable Energy
5	Kuwait Fund for Arab Economic Development	http://www.erd.gov.lk/index.php?option=com_rmobilization&view=resource_project&category_id=1&sub_category_id=1&searchby=donor_type&donor_id=5&today=2022-03-14&Itemid=321&lang=en	KW	Kaluganga Development Project (A  Co-Financing Project)	True	15.0	KWD	49.35		construction of the main dam at Pallegama; construction of one saddle dam; construction of a spillway and stilling basin; installation of irrigation intakes and outlets; Installation of new irrigation sluices	2009-03-09	1236556800			11.0	year	347133600.0	Sri Lanka Mahaweli Authority	Ministry of Mahaweli Development and Environment	Kaluganga Development Project (A  Co-Financing Project)	Loan	KD 15 Million		construction of the main dam at Pallegama; construction of one saddle dam; construction of a spillway and stilling basin; installation of irrigation intakes and outlets; Installation of new irrigation sluices	2009-03-09	11 Years	Sri Lanka Mahaweli Authority	Ministry of Mahaweli Development and Environment
29	Government of Spain	http://www.erd.gov.lk/index.php?option=com_rmobilization&view=resource_project&category_id=1&sub_category_id=1&searchby=donor_type&donor_id=29&today=2022-03-14&Itemid=321&lang=en	ES	Implementation of Anamaduwa Integrated Water Supply Project	True	42.55	EUR	46.3795			2016-02-16	1455580800						National Water Supply and Drainage Board	Ministry of City Planning and Water Supply	Implementation of Anamaduwa Integrated Water Supply Project	Loan	Euro 42,550,000			2016-02-16		National Water Supply and Drainage Board	Ministry of City Planning and Water Supply
9	Saudi Fund for Development	http://www.erd.gov.lk/index.php?option=com_rmobilization&view=resource_project&category_id=1&sub_category_id=1&searchby=donor_type&donor_id=9&today=2022-03-14&Itemid=321&lang=en	SA	Kaluganga Development Project (A Co-Financing Project)	True	46.0	USD	46.0	The Project aims at constructing the Kalu Ganga reservoir as well as building irrigation and social infrastructure.	Construction of the main dam at Pallegama; Construction of one saddle dam; Construction of a spillway and stilling basin; Installation of irrigation intakes and outlets; Installation of new irrigation sluices.	2010-09-15	1284508800						Ministry of Mahaweli Development and Environment	Sri Lanka Mahaweli Authority	Kaluganga Development Project (A Co-Financing Project)	Loan	USD 46 Mn	The Project aims at constructing the Kalu Ganga reservoir as well as building irrigation and social infrastructure.	Construction of the main dam at Pallegama; Construction of one saddle dam; Construction of a spillway and stilling basin; Installation of irrigation intakes and outlets; Installation of new irrigation sluices.	2010-09-15		Ministry of Mahaweli Development and Environment	Sri Lanka Mahaweli Authority
32	HSBC Bank	http://www.erd.gov.lk/index.php?option=com_rmobilization&view=resource_project&category_id=1&sub_category_id=1&searchby=donor_type&donor_id=32&today=2022-03-14&Itemid=321&lang=en		Construction of 210 Rural Bridges Project	True	35.0	GBP	45.5			2012-07-24	1343088000						Ministry of Local Government and Provincial Councils	Ministry of Local Government and Provincial Councils	Construction of 210 Rural Bridges Project	Loan	GBP 35,000,000			2012-07-24		Ministry of Local Government and Provincial Councils	Ministry of Local Government and Provincial Councils
10	EXIM Bank of India	http://www.erd.gov.lk/index.php?option=com_rmobilization&view=resource_project&category_id=1&sub_category_id=1&searchby=donor_type&donor_id=10&today=2022-03-14&Itemid=321&lang=en	IN	A Dollar Line of Credit of USD 45.27 Million from the Government of India for financing the Rehabilitation of Kankesanthurai Harbour	True	45.27	USD	45.27			2018-01-10	1515542400			5.0	year	157788000.0	Sri Lanka Ports Authority	Ministry of Ports and Shipping	A Dollar Line of Credit of USD 45.27 Million from the Government of India for financing the Rehabilitation of Kankesanthurai Harbour	Loan	USD 45.27 Million			2018-01-10	5 years	Sri Lanka Ports Authority	Ministry of Ports and Shipping
9	Saudi Fund for Development	http://www.erd.gov.lk/index.php?option=com_rmobilization&view=resource_project&category_id=1&sub_category_id=1&searchby=donor_type&donor_id=9&today=2022-03-14&Itemid=321&lang=en	SA	Left Bank Development Project in Kaluganga	True	45.0	USD	45.0			2017-10-24	1508803200			4.0	year	126230400.0	Ministry of Irrigation and Water Resources Management	Department of Irrigation	Left Bank Development Project in Kaluganga	Loan	USD 45 Million			2017-10-24	4 Years	Ministry of Irrigation and Water Resources Management	Department of Irrigation
17	East Asia - Japan	http://www.erd.gov.lk/index.php?option=com_rmobilization&view=resource_project&category_id=1&sub_category_id=1&searchby=donor_type&donor_id=17&today=2022-03-14&Itemid=321&lang=en	JP	Anuradhapura North Water Supply Project - Phase I (SL - P110)	True	5166.0	JPY	43.911	Provide safe drinking water for people who live in Anuradhapura North area improving the health condition of the area while contributing to the economic development.	Construction of water supply scheme Cover the water supply facilities of Medawachchiya and Rambewa DS Divisions under Mahakanadarawawa water supply scheme.; Design of Wahalkada water supply scheme.	2013-03-14	1363219200						National Water Supply and Drainage Board	Ministry of City Planning & Water Supply	Anuradhapura North Water Supply Project - Phase I (SL - P110)	Loan	JPY 5166 Mn	Provide safe drinking water for people who live in Anuradhapura North area improving the health condition of the area while contributing to the economic development.	Construction of water supply scheme Cover the water supply facilities of Medawachchiya and Rambewa DS Divisions under Mahakanadarawawa water supply scheme.; Design of Wahalkada water supply scheme.	2013-03-14		National Water Supply and Drainage Board	Ministry of City Planning & Water Supply
4	China - EXIM Bank	http://www.erd.gov.lk/index.php?option=com_rmobilization&view=resource_project&category_id=1&sub_category_id=1&searchby=donor_type&donor_id=4&today=2022-03-14&Itemid=321&lang=en	CN	Supply of 02 Nos MA - 60 Aircraft Project	True	41.0	USD	41.0	To use the passenger transportation between domestic and regional destinations.	purchasing 02 commercial aircrafts	2010-09-09	1283990400						Ministry of Ports & Aviation	Ministry of Ports & Aviation	Supply of 02 Nos MA - 60 Aircraft Project	Loan	USD 41 Mn	To use the passenger transportation between domestic and regional destinations.	purchasing 02 commercial aircrafts	2010-09-09		Ministry of Ports & Aviation	Ministry of Ports & Aviation
37	EDCF EXIM Bank of Korea	http://www.erd.gov.lk/index.php?option=com_rmobilization&view=resource_project&category_id=1&sub_category_id=1&searchby=donor_type&donor_id=37&today=2022-03-14&Itemid=321&lang=en	KR	Construction of Solid Waste Disposal Facilities Project	True	33.5	USD	33.5	Implement effective solid waste management system in selected areas of the country and contributes to minimize environment pollution and preserve comfortable urban atmosphere for the living residence.; Increase percentage of the recyclable materials.; Decreasing of waste volume being sent to land fill by composting organic waste and saving budget.	"Establishing four sanitary land filling sites in Medirigiriya in Polonnruwa district and Keerimalai in Jaffna district, Anuradhapura, Hikkaduwa with following facilities;; Storm water retention reservoir
Access roads
Rainwater and underground water drainage facility
Leachate liner system
Leachate collection facility
Leachate treatment facility
Landfill gas collection facility
Administration building and auxiliary facilities.; Storm water retention reservoir; Access roads; Rainwater and underground water drainage facility; Leachate liner system; Leachate collection facility; Leachate treatment facility; Landfill gas collection facility; Administration building and auxiliary facilities."	2013-07-23	1374537600						GOSL	Ministry of Mahaweli and Environment	Construction of Solid Waste Disposal Facilities Project	Loan	EDCF Portion - USD 33.5 Mn, GOSL Portion - USD 7.5 Mn	Implement effective solid waste management system in selected areas of the country and contributes to minimize environment pollution and preserve comfortable urban atmosphere for the living residence.; Increase percentage of the recyclable materials.; Decreasing of waste volume being sent to land fill by composting organic waste and saving budget.	"Establishing four sanitary land filling sites in Medirigiriya in Polonnruwa district and Keerimalai in Jaffna district, Anuradhapura, Hikkaduwa with following facilities;; Storm water retention reservoir
Access roads
Rainwater and underground water drainage facility
Leachate liner system
Leachate collection facility
Leachate treatment facility
Landfill gas collection facility
Administration building and auxiliary facilities.; Storm water retention reservoir; Access roads; Rainwater and underground water drainage facility; Leachate liner system; Leachate collection facility; Leachate treatment facility; Landfill gas collection facility; Administration building and auxiliary facilities."	2013-07-23		GOSL	Ministry of Mahaweli and Environment
17	East Asia - Japan	http://www.erd.gov.lk/index.php?option=com_rmobilization&view=resource_project&category_id=1&sub_category_id=1&searchby=donor_type&donor_id=17&today=2022-03-14&Itemid=321&lang=en	JP	Improvement of Basic Social Service Targeting the Emerging Regions (SL - P105)	True	3935.0	JPY	33.447500000000005	Enhancing non - communicable disease management through improvement in facilities in secondary level hospitals & ensuring drug security.	Strengthening pharmaceutical manufacturing capacity for reliable and efficient supply of the essential drugs; Strengthening secondary level hospitals (Central, Sabaragamuwa, North Western, Eastern and North Central Provinces) to provide sufficient curative services; Provide 124 ambulances to hospitals in Central, Sabaragamuwa, North western, North Central, Uva, Eastern, North Central and Northern Provinces; Construction of Teldeniya Hospital, Galgamuwa Hospital, Kalawanchikudy Hospital and Warakapola Hospital; Procurement of Medical Equipment	2012-03-28	1332892800						Ministry of Health and relevant Provincial Councils	Department of Project Management and Monitoring	Improvement of Basic Social Service Targeting the Emerging Regions (SL - P105)	Loan	JPY 3,935 Mn	Enhancing non - communicable disease management through improvement in facilities in secondary level hospitals & ensuring drug security.	Strengthening pharmaceutical manufacturing capacity for reliable and efficient supply of the essential drugs; Strengthening secondary level hospitals (Central, Sabaragamuwa, North Western, Eastern and North Central Provinces) to provide sufficient curative services; Provide 124 ambulances to hospitals in Central, Sabaragamuwa, North western, North Central, Uva, Eastern, North Central and Northern Provinces; Construction of Teldeniya Hospital, Galgamuwa Hospital, Kalawanchikudy Hospital and Warakapola Hospital; Procurement of Medical Equipment	2012-03-28		Ministry of Health and relevant Provincial Councils	Department of Project Management and Monitoring
5	Kuwait Fund for Arab Economic Development	http://www.erd.gov.lk/index.php?option=com_rmobilization&view=resource_project&category_id=1&sub_category_id=1&searchby=donor_type&donor_id=5&today=2022-03-14&Itemid=321&lang=en	KW	Project for Constructionand Rehabilitation of 25 Bridgesof the National Road Network	True	10.0	KWD	32.9	To Improve the efficiency of road transport services.	9 bridges in Western province; 3bridges in Southernprovince; 5bridges in NorthWestern province; 4bridges in Sabaragamuwaprovince; 3bridges in Northern province; A bridge in Eastern province	2014-01-30	1391040000			6.0	year	189345600.0	Road Development Authority	Ministry of Higher Education & Highways.	Project for Constructionand Rehabilitation of 25 Bridgesof the National Road Network	Loan	KD 10,000,000.00	To Improve the efficiency of road transport services.	9 bridges in Western province; 3bridges in Southernprovince; 5bridges in NorthWestern province; 4bridges in Sabaragamuwaprovince; 3bridges in Northern province; A bridge in Eastern province	2014-01-30	6 years	Road Development Authority	Ministry of Higher Education & Highways.
5	Kuwait Fund for Arab Economic Development	http://www.erd.gov.lk/index.php?option=com_rmobilization&view=resource_project&category_id=1&sub_category_id=1&searchby=donor_type&donor_id=5&today=2022-03-14&Itemid=321&lang=en	KW	Building Complex for the Faculty of Health Care Sciences Eastern University	True	10.0	KWD	32.9	To produce quality medical graduates with high competence; Provide appropriate environment for promoting the students in their studies with least constraints; Upgrade the quality of living standard of the students by providing reasonable facilities	To construct a building complex To construct a PlayGround and a pavilion; To provideinternet facilities; To construct aLaboratory; To supply Furniture, fittings, and Medical Equipment	2016-03-24	1458777600			4.0	year	126230400.0	Eastern University, Sri Lanka	Ministry of Higher Education &Highways	Building Complex for the Faculty of Health Care Sciences Eastern University	Loan	KD 10,000,000.00	To produce quality medical graduates with high competence; Provide appropriate environment for promoting the students in their studies with least constraints; Upgrade the quality of living standard of the students by providing reasonable facilities	To construct a building complex To construct a PlayGround and a pavilion; To provideinternet facilities; To construct aLaboratory; To supply Furniture, fittings, and Medical Equipment	2016-03-24	4 Years	Eastern University, Sri Lanka	Ministry of Higher Education &Highways
28	French Agency for Development	http://www.erd.gov.lk/index.php?option=com_rmobilization&view=resource_project&category_id=1&sub_category_id=1&searchby=donor_type&donor_id=28&today=2022-03-14&Itemid=321&lang=en	FR	Construction of Four Grid Substations and Related Transmission Line	True	30.0	EUR	32.7			2015-10-02	1443744000						Ceylon Electricity Board	Ministry of Power and Renewable Energy	Construction of Four Grid Substations and Related Transmission Line	Loan	Euro 30,000,000			2015-10-02		Ceylon Electricity Board	Ministry of Power and Renewable Energy
4	China - EXIM Bank	http://www.erd.gov.lk/index.php?option=com_rmobilization&view=resource_project&category_id=1&sub_category_id=1&searchby=donor_type&donor_id=4&today=2022-03-14&Itemid=321&lang=en	CN	The supply & delivery to foreign importer the materials required for lighting Sri Lanka Eastern Province project (Negenahira Nawodaya)	True	32.4	USD	32.4		Construction of New electrification Schemes - 268 new rural electrification schemes; 106 new low voltage distribution substations; 802 Km of low voltage lines; 273Km of medium voltage reinforcement tower lines and rehabilitation of 200 of low voltage distribution substations.	2012-01-16	1326672000						Ceylon Electricity Board	Ministry of Power & Renewable Energy	The supply & delivery to foreign importer the materials required for lighting Sri Lanka Eastern Province project (Negenahira Nawodaya)	Loan	USD 32.4 Million		Construction of New electrification Schemes - 268 new rural electrification schemes; 106 new low voltage distribution substations; 802 Km of low voltage lines; 273Km of medium voltage reinforcement tower lines and rehabilitation of 200 of low voltage distribution substations.	2012-01-16		Ceylon Electricity Board	Ministry of Power & Renewable Energy
9	Saudi Fund for Development	http://www.erd.gov.lk/index.php?option=com_rmobilization&view=resource_project&category_id=1&sub_category_id=1&searchby=donor_type&donor_id=9&today=2022-03-14&Itemid=321&lang=en	SA	Epilepsy Hospital and Healthcare Centres Project	True	32.0	USD	32.0	Construction of a new hospital for Epilepsy patients.	Construction of the Epilepsy Hospital Building; Supply of Medical Equipment to the Hospital	2015-10-30	1446163200						Ministry of Health Nutrition and Indigenous Medicine	Ministry of Health Nutrition and Indigenous Medicine	Epilepsy Hospital and Healthcare Centres Project	Loan	USD 32 Mn	Construction of a new hospital for Epilepsy patients.	Construction of the Epilepsy Hospital Building; Supply of Medical Equipment to the Hospital	2015-10-30		Ministry of Health Nutrition and Indigenous Medicine	Ministry of Health Nutrition and Indigenous Medicine
