donor_id	donor_name	source_url	country_code	project_name	is_loan	amount_m	currency	amount_m_usd	objectives	main_components	start_date	start_ut	end_date	end_ut	duration	duration_unit	duration_unit_ticks	implementing_agency	executing_agency	Project Name	Loan / Grant	Amount (USD)	Objective/s	Main Component/s	Commencement Date	Duration	Implementing Agency	Executing Agency
32	HSBC Bank	http://www.erd.gov.lk/index.php?option=com_rmobilization&view=resource_project&category_id=1&sub_category_id=1&searchby=donor_type&donor_id=32&today=2022-03-14&Itemid=321&lang=en		Implementation of Regional Bridges Project – Phase I	True	14000.0	JPY	119.00000000000001			2007-11-16	1195171200						Road Development Authority	Ministry of Higher Education and Highways	Implementation of Regional Bridges Project – Phase I	Loan	Yen 14 billion			2007-11-16		Road Development Authority	Ministry of Higher Education and Highways
17	East Asia - Japan	http://www.erd.gov.lk/index.php?option=com_rmobilization&view=resource_project&category_id=1&sub_category_id=1&searchby=donor_type&donor_id=17&today=2022-03-14&Itemid=321&lang=en	JP	Digitalization of Terrestrial Television Broadcasting Project (SL - P112)	True	13717.0	JPY	116.59450000000001	Digitalization of terrestrial television broadcasting system in order to increase information accessibility of people covering entire country by promoting the effective utilization of frequency resources.	Digitalization of terrestrial television broadcasting system by adopting Japan’s (ISDB-T) standard.	2014-08-23	1408752000						Telecommunication Regulatory Commission of Sri Lanka	Telecommunication Regulatory Commission of Sri Lanka	Digitalization of Terrestrial Television Broadcasting Project (SL - P112)	Loan	JICA Portion - JPY 13,717 Mn	Digitalization of terrestrial television broadcasting system in order to increase information accessibility of people covering entire country by promoting the effective utilization of frequency resources.	Digitalization of terrestrial television broadcasting system by adopting Japan’s (ISDB-T) standard.	2014-08-23		Telecommunication Regulatory Commission of Sri Lanka	Telecommunication Regulatory Commission of Sri Lanka
17	East Asia - Japan	http://www.erd.gov.lk/index.php?option=com_rmobilization&view=resource_project&category_id=1&sub_category_id=1&searchby=donor_type&donor_id=17&today=2022-03-14&Itemid=321&lang=en	JP	Rural Infrastructure Development Project in Emerging Regions	True	113.8	USD	113.8			2017-06-14	1497398400			5.0	year	157788000.0	Northern, Eastern, North Central & Uva Provincial Councils	Ministry of City Planning and Water Supply	Rural Infrastructure Development Project in Emerging Regions	Loan	113.8 Million			2017-06-14	5 years	Northern, Eastern, North Central & Uva Provincial Councils	Ministry of City Planning and Water Supply
31	Australia and New Zealand Banking Group (ANZ Bank)	http://www.erd.gov.lk/index.php?option=com_rmobilization&view=resource_project&category_id=1&sub_category_id=1&searchby=donor_type&donor_id=31&today=2022-03-14&Itemid=321&lang=en	AU	Implementation of Amapara Water Supply Project – Phase III	True	112.72	USD	112.72			2010-07-06	1278374400						National Water Supply and Drainage Board	Ministry of City Planning and Water Supply	Implementation of Amapara Water Supply Project – Phase III	Loan	USD 112,720,000			2010-07-06		National Water Supply and Drainage Board	Ministry of City Planning and Water Supply
17	East Asia - Japan	http://www.erd.gov.lk/index.php?option=com_rmobilization&view=resource_project&category_id=1&sub_category_id=1&searchby=donor_type&donor_id=17&today=2022-03-14&Itemid=321&lang=en	JP	Major Bridges Construction Project of the National Road Network (SL - P108)	True	12381.0	JPY	105.2385	To construct 18 major bridges of the national road network whose overall length is more than 30 meters using advanced technologies to meet the traffic congestion.	Construction of 18 major bridges of the national road network which are more than 30m in length including 13 bridges in Western Province, in Northern and Southern Provinces.	2013-03-14	1363219200						Road Development Authority	Ministry of Higher Education & Highways	Major Bridges Construction Project of the National Road Network (SL - P108)	Loan	JPY 12,381 Mn	To construct 18 major bridges of the national road network whose overall length is more than 30 meters using advanced technologies to meet the traffic congestion.	Construction of 18 major bridges of the national road network which are more than 30m in length including 13 bridges in Western Province, in Northern and Southern Provinces.	2013-03-14		Road Development Authority	Ministry of Higher Education & Highways
12	China Development Bank (CDB)	http://www.erd.gov.lk/index.php?option=com_rmobilization&view=resource_project&category_id=1&sub_category_id=1&searchby=donor_type&donor_id=12&today=2022-03-14&Itemid=321&lang=en	CN	Thambuttegama Water Supply Project	True	102.5	USD	102.5		Construction of water intake structure with a capacity of 42,000 m3/day.; Construction of water treatment plant of 18,000m3/day; Construction of ground reservoir of 1,500 m3 capacity; Construction of raw water and treated water transmission mains totaling up to an approximate length of 50 Km; Construction of elevated towers of 1,500 m3 capacity; Construction of distribution network  of 135 KM; Construction of facilities to operate and maintain the water supply scheme.	2017-08-21	1503273600						National Water Supply & Drainage Board	Ministry of City Planning & Water Supply	Thambuttegama Water Supply Project	Loan	102.5		Construction of water intake structure with a capacity of 42,000 m3/day.; Construction of water treatment plant of 18,000m3/day; Construction of ground reservoir of 1,500 m3 capacity; Construction of raw water and treated water transmission mains totaling up to an approximate length of 50 Km; Construction of elevated towers of 1,500 m3 capacity; Construction of distribution network  of 135 KM; Construction of facilities to operate and maintain the water supply scheme.	2017-08-21		National Water Supply & Drainage Board	Ministry of City Planning & Water Supply
10	EXIM Bank of India	http://www.erd.gov.lk/index.php?option=com_rmobilization&view=resource_project&category_id=1&sub_category_id=1&searchby=donor_type&donor_id=10&today=2022-03-14&Itemid=321&lang=en	IN	A Loan of USD 100 Million from the Government of India to purchase equipment/supplies from India	True	100.0	USD	100.0			2008-03-31	1206921600						Sri Lanka Army, Sri Lanka Navy, Sri Lanka Air Force, Sri Lanka Police	Ministry of Defence	A Loan of USD 100 Million from the Government of India to purchase equipment/supplies from India	Loan	USD 100 Million			2008-03-31		Sri Lanka Army, Sri Lanka Navy, Sri Lanka Air Force, Sri Lanka Police	Ministry of Defence
12	China Development Bank (CDB)	http://www.erd.gov.lk/index.php?option=com_rmobilization&view=resource_project&category_id=1&sub_category_id=1&searchby=donor_type&donor_id=12&today=2022-03-14&Itemid=321&lang=en	CN	Rehabililitation & improvement of Priority Road Projects - 3 (Phase 2)	True	100.0	USD	100.0	Improve and rehabilitate priority road sections in Sabaragamuwa & Central Province; Ensure the connectivity among already improved road sections	Package No 1 - C23 Katugastota - Medawala Road  - 10Km; Package No 1 - C24 Thibbutta Junction - From Demaralaawa - Penanetipola - Battagalla Road - 5Km; Package No 2 - C25 Hapugahayatatenna - Watadeniya Road - 8Km; Package No 2 - C26 Naranwita - Udadeniya - Wewatenna - Niyangama Road - 5Km; Package No 2 - C27 Heen Narandeniya Junction - Udiwita Elpitiya Road Elipitiya river - Weligalla Junction - 5Km; Package No 2 - C28 From Nilamba Gurukale Junction to Godawala (Doluwa Road) on Starting from Kandy Galaha Main Road (6 km) - 6Km; Package No 3 - C29 Kotaligoda - Thismada Road - 5Km; Package No 3 - C30 Eramuduliyadda - Kolugala - Thismada Road - 5Km; Package No 4 - C31 Nawalapitiya - Nagaswella Road - 11Km; Package No 4 - C32 From Wahugapitiya - Nuwara Eliya Road to Doragala Via Chappiliyawatta - 2Km; Package No 5 - C33 Yatirawana - Balapola Road - 2Km; Package No 5 - C34 Mahamaya Mawatha From Rajapeela Junction (Wakarawatta Junction) Ampitiya  Road up to Devom Hotel and Ampitiya Road Hilpenkadura Mawatha & By Roads ta - 1.75Km; Package No 5 - C35 Mahanuwara Aruppola Mawatha No.5 (From Bakery Junction to Aruppola Junction) - 0.5Km; Package No A - C36 Rambukkana - Mawanella Road - 11.79Km; Package No A - C37 Bulugolla-Dombe-Wahawa Road - 7.65Km; Package No A - C38 Mawanella-Aranayaka-Horewela Road - 14.43Km; Package No B - C39 Gevilipitiya-Hettimulla Road - 14Km; Package No B - C40 Kegalle-Bulathkohupitiya-Karawanella Road - 10.35Km; Package No B - C41 Kegalle-Siyabalapitiya-Dewalagema Road - 2.63Km; Package No B - C42 Mabopitiya-Degalathiriya Road - 1.75Km	2014-11-24	1416787200						Road Development Authority	Ministry of Higher Education & Highways	Rehabililitation & improvement of Priority Road Projects - 3 (Phase 2)	Loan	USD 100 Mn	Improve and rehabilitate priority road sections in Sabaragamuwa & Central Province; Ensure the connectivity among already improved road sections	Package No 1 - C23 Katugastota - Medawala Road  - 10Km; Package No 1 - C24 Thibbutta Junction - From Demaralaawa - Penanetipola - Battagalla Road - 5Km; Package No 2 - C25 Hapugahayatatenna - Watadeniya Road - 8Km; Package No 2 - C26 Naranwita - Udadeniya - Wewatenna - Niyangama Road - 5Km; Package No 2 - C27 Heen Narandeniya Junction - Udiwita Elpitiya Road Elipitiya river - Weligalla Junction - 5Km; Package No 2 - C28 From Nilamba Gurukale Junction to Godawala (Doluwa Road) on Starting from Kandy Galaha Main Road (6 km) - 6Km; Package No 3 - C29 Kotaligoda - Thismada Road - 5Km; Package No 3 - C30 Eramuduliyadda - Kolugala - Thismada Road - 5Km; Package No 4 - C31 Nawalapitiya - Nagaswella Road - 11Km; Package No 4 - C32 From Wahugapitiya - Nuwara Eliya Road to Doragala Via Chappiliyawatta - 2Km; Package No 5 - C33 Yatirawana - Balapola Road - 2Km; Package No 5 - C34 Mahamaya Mawatha From Rajapeela Junction (Wakarawatta Junction) Ampitiya  Road up to Devom Hotel and Ampitiya Road Hilpenkadura Mawatha & By Roads ta - 1.75Km; Package No 5 - C35 Mahanuwara Aruppola Mawatha No.5 (From Bakery Junction to Aruppola Junction) - 0.5Km; Package No A - C36 Rambukkana - Mawanella Road - 11.79Km; Package No A - C37 Bulugolla-Dombe-Wahawa Road - 7.65Km; Package No A - C38 Mawanella-Aranayaka-Horewela Road - 14.43Km; Package No B - C39 Gevilipitiya-Hettimulla Road - 14Km; Package No B - C40 Kegalle-Bulathkohupitiya-Karawanella Road - 10.35Km; Package No B - C41 Kegalle-Siyabalapitiya-Dewalagema Road - 2.63Km; Package No B - C42 Mabopitiya-Degalathiriya Road - 1.75Km	2014-11-24		Road Development Authority	Ministry of Higher Education & Highways
10	EXIM Bank of India	http://www.erd.gov.lk/index.php?option=com_rmobilization&view=resource_project&category_id=1&sub_category_id=1&searchby=donor_type&donor_id=10&today=2022-03-14&Itemid=321&lang=en	IN	Polgahawela, Pothuhera and Alawwa Integrated Water Supply Project	True	91.8	USD	91.8			2016-03-08	1457395200			4.0	year	126230400.0	National Water Supply & Drainage Board	Ministry of City Planning & Water Supply	Polgahawela, Pothuhera and Alawwa Integrated Water Supply Project	Loan	USD 91.8 Million			2016-03-08	4 Years	National Water Supply & Drainage Board	Ministry of City Planning & Water Supply
4	China - EXIM Bank	http://www.erd.gov.lk/index.php?option=com_rmobilization&view=resource_project&category_id=1&sub_category_id=1&searchby=donor_type&donor_id=4&today=2022-03-14&Itemid=321&lang=en	CN	Consultancy Services for Design Review & Construction Supervision of Civil Works on Extension of Southern Expressway Project.	True	90.0	USD	90.0		Provide consultancy service for design review and construction supervsion of civil work of the Southern Expressway from Matara to Hambantota.	2017-01-22	1485043200			5.0	year	157788000.0	Road Development Authority	Ministry of Higher Education & Highways	Consultancy Services for Design Review & Construction Supervision of Civil Works on Extension of Southern Expressway Project.	Loan	90 mn		Provide consultancy service for design review and construction supervsion of civil work of the Southern Expressway from Matara to Hambantota.	2017-01-22	5 Years	Road Development Authority	Ministry of Higher Education & Highways
4	China - EXIM Bank	http://www.erd.gov.lk/index.php?option=com_rmobilization&view=resource_project&category_id=1&sub_category_id=1&searchby=donor_type&donor_id=4&today=2022-03-14&Itemid=321&lang=en	CN	Colombo Lotus Tower Project	True	88.6	USD	88.6	To establish a multipurpose television and telecommunication tower with a leisure park in Colombo.	Construction of a 350m high multifunctional tower with a floor area including Radio and TV Transmission, Restaurants, Hotels, Conference & Exhibition facilities with a Leisure Park.	2012-09-17	1347840000						Telecommunications Regulatory Commission of Sri Lanka	Presidential Secretariat of Sri Lanka	Colombo Lotus Tower Project	Loan	USD 88.6 Mn	To establish a multipurpose television and telecommunication tower with a leisure park in Colombo.	Construction of a 350m high multifunctional tower with a floor area including Radio and TV Transmission, Restaurants, Hotels, Conference & Exhibition facilities with a Leisure Park.	2012-09-17		Telecommunications Regulatory Commission of Sri Lanka	Presidential Secretariat of Sri Lanka
28	French Agency for Development	http://www.erd.gov.lk/index.php?option=com_rmobilization&view=resource_project&category_id=1&sub_category_id=1&searchby=donor_type&donor_id=28&today=2022-03-14&Itemid=321&lang=en	FR	Sanitation Hygiene Initiative for Towns Project - Phase I	True	76.0	EUR	82.84			2016-06-01	1464739200						National Water Supply and Drainage Board	Ministry of City Planning and Water Supply	Sanitation Hygiene Initiative for Towns Project - Phase I	Loan	Euro 76,000,000			2016-06-01		National Water Supply and Drainage Board	Ministry of City Planning and Water Supply
17	East Asia - Japan	http://www.erd.gov.lk/index.php?option=com_rmobilization&view=resource_project&category_id=1&sub_category_id=1&searchby=donor_type&donor_id=17&today=2022-03-14&Itemid=321&lang=en	JP	Habarana - Veyangoda Transmission Line Project SL - P106	True	9573.0	JPY	81.3705	Improve the stability & reliability of the electricity transmission system and to cater the growing demand of the country.	Construction of 220kV Transmission Line in 148km length, between new Habarana substation and Veyangoda Grid Station; Terminating 132kV Habarana - Anuradhapura old transmission lines to New Habarana; Shifting 132kV Habarana - Ukuwela, Habarana - Valachchenai transmission lines to New Habarana; Construction of 220kV Double in & Out connection from Kothmale to Anuradhapura transmission line; Construction of New Habarana Switching station and Augmentation of Veyangoda Substation.	2012-03-28	1332892800						Ceylon Electricity Board	Ministry of Power & Renewable Energy	Habarana - Veyangoda Transmission Line Project SL - P106	Loan	JPY 9,573 Mn	Improve the stability & reliability of the electricity transmission system and to cater the growing demand of the country.	Construction of 220kV Transmission Line in 148km length, between new Habarana substation and Veyangoda Grid Station; Terminating 132kV Habarana - Anuradhapura old transmission lines to New Habarana; Shifting 132kV Habarana - Ukuwela, Habarana - Valachchenai transmission lines to New Habarana; Construction of 220kV Double in & Out connection from Kothmale to Anuradhapura transmission line; Construction of New Habarana Switching station and Augmentation of Veyangoda Substation.	2012-03-28		Ceylon Electricity Board	Ministry of Power & Renewable Energy
32	HSBC Bank	http://www.erd.gov.lk/index.php?option=com_rmobilization&view=resource_project&category_id=1&sub_category_id=1&searchby=donor_type&donor_id=32&today=2022-03-14&Itemid=321&lang=en		Purchase and Delivery of 09 Nos Diesel Multiple Units for Upcountry Line Operations in Sri Lanka Railways Project	True	79.8	USD	79.8			2018-04-27	1524787200						Ministry of Transport and Civil Aviation	Ministry of Transport and Civil Aviation	Purchase and Delivery of 09 Nos Diesel Multiple Units for Upcountry Line Operations in Sri Lanka Railways Project	Loan	79.8 Million			2018-04-27		Ministry of Transport and Civil Aviation	Ministry of Transport and Civil Aviation
4	China - EXIM Bank	http://www.erd.gov.lk/index.php?option=com_rmobilization&view=resource_project&category_id=1&sub_category_id=1&searchby=donor_type&donor_id=4&today=2022-03-14&Itemid=321&lang=en	CN	Greater Kurunegala Water Supply & Sanitation Project	True	77.0	USD	77.0	To meet the present & future demand of drinking water in the Greater Kurunegala area.	Increasing water supply capacity from 6500m3/d to 13000m3/d and establish a proper waste water disposal system with a capacity 0f 4500m3/d.	2013-09-18	1379462400						National Water Supply & Drainage Board	Ministry of City Planning & Water Supply	Greater Kurunegala Water Supply & Sanitation Project	Loan	USD 77 Mn	To meet the present & future demand of drinking water in the Greater Kurunegala area.	Increasing water supply capacity from 6500m3/d to 13000m3/d and establish a proper waste water disposal system with a capacity 0f 4500m3/d.	2013-09-18		National Water Supply & Drainage Board	Ministry of City Planning & Water Supply
37	EDCF EXIM Bank of Korea	http://www.erd.gov.lk/index.php?option=com_rmobilization&view=resource_project&category_id=1&sub_category_id=1&searchby=donor_type&donor_id=37&today=2022-03-14&Itemid=321&lang=en	KR	Ruhunupura Water Supply Project	True	76.0	USD	76.0	Provide safe drinking water to a population of about 112,000 people; Cater the Commercial and Industrial water demand of the area; Cater the future water demand of the area which has been assessed as 35000 m3 day in the year 2025; Source improvement and construction of an intake at Ridiyagama tank; Construction of a 17,500m3/day  treatment plant at Koggalla; Ssupply and laying of 45 km of water transmission system; Construction of 4 ground reservoirs and 4 elevated towers; Supply and laying of 400 km long distribution pipe network		2009-04-16	1239840000						National Water Supply and Drainage Board	Ministry of Water Supply and Drainage	Ruhunupura Water Supply Project	Loan	76 Milion	Provide safe drinking water to a population of about 112,000 people; Cater the Commercial and Industrial water demand of the area; Cater the future water demand of the area which has been assessed as 35000 m3 day in the year 2025; Source improvement and construction of an intake at Ridiyagama tank; Construction of a 17,500m3/day  treatment plant at Koggalla; Ssupply and laying of 45 km of water transmission system; Construction of 4 ground reservoirs and 4 elevated towers; Supply and laying of 400 km long distribution pipe network		2009-04-16		National Water Supply and Drainage Board	Ministry of Water Supply and Drainage
17	East Asia - Japan	http://www.erd.gov.lk/index.php?option=com_rmobilization&view=resource_project&category_id=1&sub_category_id=1&searchby=donor_type&donor_id=17&today=2022-03-14&Itemid=321&lang=en	JP	The Project of the Establishment of a Doppler Weather Radar Network in Sri Lanka	False	72.6	USD	72.6		Constructing  the tower buildings to establish a Doppler Weather Radar Network; Including C- Band Pulse Compression, Meteorological Radar Central Processing System, Meteorological Radar Data Display Systems and Meteorological Data Communication System; Giving technical support for strengthening the monitoring capability of hazardous meteorological phenomena of the staff of the Department of Meteorology.	2017-02-02	1485993600			7.0	year	220903200.0	Department of Meteorology	Ministry of Disaster Management	The Project of the Establishment of a Doppler Weather Radar Network in Sri Lanka	Grant	72.6 Million		Constructing  the tower buildings to establish a Doppler Weather Radar Network; Including C- Band Pulse Compression, Meteorological Radar Central Processing System, Meteorological Radar Data Display Systems and Meteorological Data Communication System; Giving technical support for strengthening the monitoring capability of hazardous meteorological phenomena of the staff of the Department of Meteorology.	2017-02-02	7 Years	Department of Meteorology	Ministry of Disaster Management
32	HSBC Bank	http://www.erd.gov.lk/index.php?option=com_rmobilization&view=resource_project&category_id=1&sub_category_id=1&searchby=donor_type&donor_id=32&today=2022-03-14&Itemid=321&lang=en		Upgrading Health Facilities in Selected Hospitals	True	72.25	USD	72.25			2019-06-21	1561075200			4.0	year	126230400.0	Ministry of Health & Indigenous Medicine	Ministry of Health & Indigenous Medicine	Upgrading Health Facilities in Selected Hospitals	Loan	72.25 million			2019-06-21	4 Years	Ministry of Health & Indigenous Medicine	Ministry of Health & Indigenous Medicine
28	French Agency for Development	http://www.erd.gov.lk/index.php?option=com_rmobilization&view=resource_project&category_id=1&sub_category_id=1&searchby=donor_type&donor_id=28&today=2022-03-14&Itemid=321&lang=en	FR	Ambatale Water Supply System Improvements & Energy Saving Project	True	70.0	USD	70.0			2014-09-29	1411948800						National Water Supply and Drainage Board	Ministry of City Planning and Water Supply	Ambatale Water Supply System Improvements & Energy Saving Project	Loan	USD 70,000,000			2014-09-29		National Water Supply and Drainage Board	Ministry of City Planning and Water Supply
13	China - Industrial & Commercial Bank	http://www.erd.gov.lk/index.php?option=com_rmobilization&view=resource_project&category_id=1&sub_category_id=1&searchby=donor_type&donor_id=13&today=2022-03-14&Itemid=321&lang=en	CN	Broadlands HydroPower Project	True	69.7	USD	69.7	To generate significant economic benefits to the country through the development of low cost renewable power sources.	Construction of 24m high & 144m long main dam, 19m high & 48m long diversion dam, 2.7m diameter & 850m long diversion tunnel, 5.4m diameter & 3Km long main tunnel, 35MW surface power station (2 units of 17.5MW), switch yard and 4Km long transmission line.	2013-01-16	1358294400						Ceylon Electricity Board	Ministry of Power & Renewable Energy	Broadlands HydroPower Project	Loan	USD 69.7 Mn	To generate significant economic benefits to the country through the development of low cost renewable power sources.	Construction of 24m high & 144m long main dam, 19m high & 48m long diversion dam, 2.7m diameter & 850m long diversion tunnel, 5.4m diameter & 3Km long main tunnel, 35MW surface power station (2 units of 17.5MW), switch yard and 4Km long transmission line.	2013-01-16		Ceylon Electricity Board	Ministry of Power & Renewable Energy
37	EDCF EXIM Bank of Korea	http://www.erd.gov.lk/index.php?option=com_rmobilization&view=resource_project&category_id=1&sub_category_id=1&searchby=donor_type&donor_id=37&today=2022-03-14&Itemid=321&lang=en	KR	Improvement of Anuradhapura – Padeniya Road	True	66.0	USD	66.0	Improve the road section between Padeniya-Anuradhapura to provide high mobility transport	Shorten the travel time and travel cost.; Improve quality of public transportation service and decrease the traffic accident.; Promote National economic development and balanced regional development.; Improve tourist industry.	2008-12-19	1229644800						Road Development Authority	Ministry of Highways and Road Development	Improvement of Anuradhapura – Padeniya Road	Loan	66 Milion	Improve the road section between Padeniya-Anuradhapura to provide high mobility transport	Shorten the travel time and travel cost.; Improve quality of public transportation service and decrease the traffic accident.; Promote National economic development and balanced regional development.; Improve tourist industry.	2008-12-19		Road Development Authority	Ministry of Highways and Road Development
4	China - EXIM Bank	http://www.erd.gov.lk/index.php?option=com_rmobilization&view=resource_project&category_id=1&sub_category_id=1&searchby=donor_type&donor_id=4&today=2022-03-14&Itemid=321&lang=en	CN	Bunkering Facility & Tank Farm Project	True	65.0	USD	65.0	The project objective is to supply & store marine fuel, aviation fuel & L.P gas & provide bunkering services for the vessels passing by Sri Lanka.	Constuction of a bulk storage tank farm with a capacity of 82,000 cubic meters with mixing facilities of fuel oil; Connection of pipe lines from tank farm to the oil terminal; Loading & unloading facilities & other service connections.	2009-06-08	1244419200						Sri Lanka Ports Authority	Ministry of Ports & Shipping	Bunkering Facility & Tank Farm Project	Loan	USD 65 Mn	The project objective is to supply & store marine fuel, aviation fuel & L.P gas & provide bunkering services for the vessels passing by Sri Lanka.	Constuction of a bulk storage tank farm with a capacity of 82,000 cubic meters with mixing facilities of fuel oil; Connection of pipe lines from tank farm to the oil terminal; Loading & unloading facilities & other service connections.	2009-06-08		Sri Lanka Ports Authority	Ministry of Ports & Shipping
27	Export – Import Bank of the United States	http://www.erd.gov.lk/index.php?option=com_rmobilization&view=resource_project&category_id=1&sub_category_id=1&searchby=donor_type&donor_id=27&today=2022-03-14&Itemid=321&lang=en	US	Implementation of Badulla, Haliela and Ella Integrated Water Supply Project	True	64.892724	USD	64.892724			2013-07-01	1372636800						National Water Supply and Drainage Board	Ministry of City Planning and Water Supply	Implementation of Badulla, Haliela and Ella Integrated Water Supply Project	Loan	USD 64,892,724			2013-07-01		National Water Supply and Drainage Board	Ministry of City Planning and Water Supply
